{
  "schema_version": 1,
  "schema_uri": "https://rsasaki0109.github.io/lidar_slam_ros2/schemas/publication-slice-plan-v1.schema.json",
  "generated_at": "2026-08-17T20:15:04+09:00",
  "candidate": {
    "repository": "rsasaki0109/lidar_slam_ros2",
    "pull_request": 427,
    "base_sha": "3f4dd70cdc58ad421192559213cdee0bdc41eba8",
    "public_head_sha": "3ed632e6f6aa1e3ca7f32d893773de1079086ffb",
    "expected_path_count": 349,
    "expected_paths_sha256": "48a99e65edd16c172a5658767c23d7054ef3f296d43a5385a0946dc7d8329710",
    "scope": "worktree-delta-from-pr-base"
  },
  "whole_pr_review": {
    "base_sha": "86fa9b610c07ccf4d2b0f10939e17c129d34b40a",
    "expected_path_count": 396,
    "expected_paths_sha256": "b303b004014ddb097efa68b905c4438bebda5f07f867cbb07073de1f820f0a16",
    "coverage_policy": "union-covers-final-diff",
    "linear_history_required": true,
    "initial_review": {
      "start_sha": "86fa9b610c07ccf4d2b0f10939e17c129d34b40a",
      "end_sha": "6a8727a9014aea1ecfe8ea9c65d6f10cffb87cd3",
      "diff_mode": "three-dot",
      "expected_commit_count": 42,
      "expected_path_count": 116,
      "expected_paths_sha256": "e198d45b869f68042311eda9f9876d05bc1561a57c54bdffc75a9779d1b3cc14",
      "review_record": "docs/evidence/growth/g0-clean-candidate-audit-2026-08-11.md"
    },
    "bridge_review": {
      "start_sha": "6a8727a9014aea1ecfe8ea9c65d6f10cffb87cd3",
      "end_sha": "3f4dd70cdc58ad421192559213cdee0bdc41eba8",
      "diff_mode": "two-dot",
      "expected_commit_count": 2,
      "expected_path_count": 11,
      "expected_paths_sha256": "dddadf04f04d38fcc86f0a4d4a7926a2eb8b9528e63df665750395a772c20416",
      "allowed_paths": [
        "docs/evidence/growth/g0-clean-candidate-audit-2026-08-11.md",
        "docs/evidence/growth/g0-external-action-decision-packet-2026-08-11.md",
        "graph_based_slam/test/test_mid360_robot_public_datasets.py",
        "graph_based_slam/test/test_product_python_tests_script.py",
        "lidarslam/test/test_audit_published_fixture.py",
        "lidarslam/test/test_check_fixture_publication.py",
        "lidarslam/test/test_check_issue_triage_proposal.py",
        "lidarslam/test/test_check_onboarding_trial_matrix.py",
        "lidarslam/test/test_collect_runtime_apt_packages.py",
        "lidarslam/test/test_measure_oci_archive.py",
        "lidarslam/test/test_runtime_docker_image_contract.py"
      ],
      "review_record": "docs/evidence/growth/g0-pr-review-coverage-2026-08-17.md"
    },
    "follow_up_review": {
      "start_sha": "3f4dd70cdc58ad421192559213cdee0bdc41eba8",
      "end_ref": "c5cbc9f81c5849109321ac3585b41afa5b6270fb",
      "diff_mode": "two-dot",
      "review_record": "docs/evidence/growth/g0-publication-slice-plan-2026-08-12.md"
    }
  },
  "review_slices": [
    {
      "id": "S1-runtime-safety",
      "order": 1,
      "title": "Runtime point-cloud and VoxelGrid safety",
      "review_outcome": "Malformed or oversized layouts, plus readable samples with empty frame IDs, fail closed without terminating the mapping process; rejected map updates preserve the movement threshold for an immediate safe retry, asynchronous exceptions stay inside the component boundary, and valid point clouds retain their fields.",
      "depends_on": [],
      "paths": [
        "docs/evidence/voxel-grid-overflow-safety-2026-08-11.md",
        "graph_based_slam/include/graph_based_slam/pointcloud_conversion.hpp",
        "graph_based_slam/include/graph_based_slam/registration_factory.hpp",
        "graph_based_slam/src/graph_based_slam_component_impl.hpp",
        "graph_based_slam/src/graph_slam_application.cpp",
        "graph_based_slam/src/graph_slam_offline_runner.cpp",
        "graph_based_slam/src/graph_slam_ros_adapter.cpp",
        "graph_based_slam/test/test_mid360_robot_public_dataset_map_runner.py",
        "graph_based_slam/test/test_mid360_robot_tools.py",
        "graph_based_slam/test/test_pointcloud_conversion.cpp",
        "scanmatcher/CHANGELOG.rst",
        "scanmatcher/CMakeLists.txt",
        "scanmatcher/include/scanmatcher/scanmatcher_component.h",
        "scanmatcher/src/scanmatcher_component.cpp",
        "scanmatcher/test/test_scanmatcher_voxel_grid_recovery.cpp",
        "scripts/lidarslam_tools/mid360_preflight.py"
      ],
      "verification": [
        "python3 -m pytest -q -p no:cacheprovider graph_based_slam/test/test_mid360_robot_tools.py -k frame",
        "source \"/opt/ros/${ROS_DISTRO:-jazzy}/setup.bash\" && colcon build --packages-up-to graph_based_slam scanmatcher && colcon test --packages-select graph_based_slam scanmatcher",
        "colcon test-result --verbose"
      ],
      "publication_gate": "PUBLIC_CI"
    },
    {
      "id": "S2-first-map-foundation",
      "order": 2,
      "title": "One-command first map and resilient runtime foundation",
      "review_outcome": "A user can inspect a bag, build a verified map, reopen it in a local 3D preview, recover from bounded runtime failures, and retry low-storage demo rejection without calculating the shortage or rebuilding the command. Product-dispatched native bag opens omit routine storage INFO while retaining WARN/ERROR, direct use, and explicit expert levels. A real guided completion shows only the selected profile, storage decision, honest progress, and one verified terminal handoff while direct expert execution detail remains available. Hidden routine workflow output remains checksum-bound, and an ordinary workflow failure replays a bounded diagnostic tail. The unchanged 5 GiB start preflight is exercised in real ROS, and a sealed expected SIGINT or SIGTERM gets one concise retained-evidence line without weakening ordinary failure or genuine startup and offline-completion timeout diagnostics.",
      "depends_on": [
        "S1-runtime-safety"
      ],
      "paths": [
        ".github/workflows/docker.yml",
        "Dockerfile",
        "docs/schemas/docker-map-bag-plan-v1.schema.json",
        "docs/schemas/first-map-demo-plan-v1.schema.json",
        "docs/schemas/preflight-v4.schema.json",
        "docs/schemas/preflight-v5.schema.json",
        "docs/schemas/preflight-v6.schema.json",
        "graph_based_slam/test/test_autoware_dogfood_script.py",
        "graph_based_slam/test/test_autoware_map_preflight.py",
        "graph_based_slam/test/test_autoware_map_run_diagnosis.py",
        "graph_based_slam/test/test_docker_demo_script.py",
        "graph_based_slam/test/test_mid360_robot_3d_map_preview.py",
        "graph_based_slam/test/test_mid360_robot_public_datasets.py",
        "lidarslam/launch/rko_lio_slam.launch.py",
        "lidarslam/test/test_autoware_map_runner_script.py",
        "lidarslam/test/test_docker_map_bag.py",
        "lidarslam/test/test_first_map_demo.py",
        "lidarslam/test/test_rko_lio_launch_config.py",
        "lidarslam/test/test_runtime_docker_image_contract.py",
        "lidarslam/test/test_view_autoware_map.py",
        "scripts/docker_map_bag.sh",
        "scripts/export_mid360_robot_3d_map_preview.py",
        "scripts/first_map_demo.py",
        "scripts/mid360_robot_3d_map_preview.py",
        "scripts/mid360_robot_loop_alignment_analyzer.py",
        "scripts/mid360_robot_public_datasets.py",
        "scripts/preflight_autoware_map_bag.py",
        "scripts/record_backend_input.sh",
        "scripts/run_autoware_map_from_bag.py",
        "scripts/run_first_map_demo.sh",
        "scripts/run_offline_determinism_check.sh",
        "scripts/run_rko_lio_graph_autoware_dogfood.sh",
        "scripts/view_autoware_map.py",
        "scripts/wait_for_offline_output_subscribers.sh"
      ],
      "verification": [
        "python3 -m pytest -q -p no:cacheprovider lidarslam/test/test_first_map_demo.py lidarslam/test/test_docker_map_bag.py lidarslam/test/test_view_autoware_map.py",
        "python3 -m pytest -q -p no:cacheprovider graph_based_slam/test/test_autoware_map_preflight.py graph_based_slam/test/test_docker_demo_script.py"
      ],
      "publication_gate": "PUBLIC_CI"
    },
    {
      "id": "S3-map-lifecycle",
      "order": 3,
      "title": "Sensor setup, session history, map editing, merging, and support",
      "review_outcome": "Users can move beyond a first map without hand-editing commands or losing provenance, recovery state, or support-safe evidence; confirmed starts move from one calibration decision through one concise product-owned progress stream to one terminal card, with exactly one safe Next action on success or failure and complete structured evidence retained. Internal delegated commands, YAML paths, topic/frame details, staging promises, lifecycle duplication, launch-log locations, and routine post-processing output stay out of guided output while direct expert run and dogfood output remain complete. The hidden output is retained in a manifest-bound workflow log, normal failure replays its bounded tail, and real complete-map plus Ctrl-C cleanup are exercised on one exact install. A verified result explicitly offers the first-class read-only report command instead of implying automatic sharing; the legacy spelling, compatibility-keyed structured action, and JSON schema remain stable, exact-installed human/JSON outputs match, and reads leave the session tree unchanged without archive creation or network access. An unchanged live stage stays visibly active through a bounded 30-second terminal heartbeat with monotonic elapsed time, no ETA or forward-progress claim, and no session-artifact rewrite. After the unchanged 5 GiB preflight, one Ctrl-C makes the stable CLI wait for the start helper, signals the complete isolated delegated process group, waits through bounded cleanup and terminal-evidence sealing, and returns through the same one-action recovery handoff without routine native reader INFO, a Python traceback, synthesized success, false timeout label, recent-launch-log dump, repeated failed command, or duplicate generic session error.",
      "depends_on": [